Name, Price, Quantity, Unit
Estadio Basic Beyblade,29.90,1,un
Muñecas de Acción DC SUPER HERO GIRLS,79.90,1,un
Parque Policial 4 Autos 29 Piezas,39.95,1,un
Dulcería con Accesorios,69.50,1,un
Barbie Peinados De Arcoíris y Accesorios,199.90,1,un
Barbie Mega Caja Registradora,199.90,1,un
Tocador con Accesorios My Beauty Set,34.95,1,un
Barbie Baño de Perritos,129.90,1,un
Figura Canuck with Boom Boom Bike,29.98,1,un
Cars Acrobacias Xtremas Salto en el Aire,49.90,1,un
Mega Bloks Gran Bolsa Rosa para Construir 80 piezas,44.90,1,un
Aspiradora de Juguete XIONG SEN XS-14054,23.97,1,un
Juego De Mesa Clásicos,39.95,1,un
Hot Wheels  Paquete De 3,14.90,1,un
Barbie Básica Surtido,14.90,1,un
Dino Herramientas PLAY-DOH,49.90,1,un
Pack ARTESCO Spiderman Slime,24.90,1,un
Juego BAKUGAN Battle Planet Pack de Inicio,99.90,1,un
Muñeca De Juego Sparkle Girlz,17.97,1,un
Frozen Set De Te,39.90,1,un
Transportador de Autos,23.97,1,un
Muñeca y Unicornio Rocker,29.95,1,un
